{
 "version": 1,
 "generated": "2026-08-11",
 "note": "Canonical domain coverage matrix. Every relevant EOS capability has a row: built packs and registry-only domains alike. Omissions are rows, never silence, and a backlog row is not coverage. registry/CAPABILITIES.md is the derived view of this file. Pack lanes write coverage fragments under their claimed pack path; the integrator alone imports them here.",
 "rows": [
  {
   "capability": "agentic-development-and-orchestration",
   "status": "built",
   "pack": "packs/agentic-development/",
   "activation": "Paths: agent and subagent definitions, instruction and prompt files, tool and MCP definitions, harness runners, workflow graphs, guardrail registration, checkpoint stores, trace configuration. Task types: designing an agent workflow, adding or removing a subagent, changing a tool surface, setting run budgets, adding a checkpoint or approval, diagnosing a looping or stalling agent. Predicates: builds_agent_workflow, orchestrates_multiple_agents, designs_agent_harness, defines_agent_tools.",
   "evidence_sources": [
    "EV-0109",
    "EV-0110",
    "EV-0111",
    "EV-0112",
    "EV-0113",
    "EV-0114",
    "EV-0115",
    "EV-0116",
    "EV-0117",
    "EV-0118",
    "EV-0119",
    "EV-0120",
    "EV-0121"
   ],
   "worked_example": [
    "packs/agentic-development/exemplars/EX-AGENT-001-logging-migration.md"
   ],
   "evaluation_method": "packs/agentic-development/CHECKS.md, the reviewable criteria for this domain. The acceptance drill is frozen at benchmark/drills/agentic-development.md and has never been run: benchmark/drills/RESULTS.json holds no verdict for it, and ADR-0007 defers running the drills rather than treating them as a release gate.",
   "estate_relevance": "Every EOS session runs under this pack, and PatterStage dispatches agent runs while PatterStudio runs a LangGraph orchestrator. The most load-bearing pack in the estate.",
   "owner": "EOS integrator",
   "review_trigger": "on-change-of:agent-sdk-major-release"
  },
  {
   "capability": "agentic-swarm-and-graph-engineering",
   "status": "built",
   "pack": "packs/agentic-swarm/",
   "activation": "Paths: the claim file, partition artefacts, lane briefs and packets, worktree layout, orchestration scripts and workflow files, and the graph-build method a venture seed compiles from its kernel template. Task types: deciding whether to fan out at all, cutting a partition from a product map, writing or reviewing a lane packet, sizing lanes, choosing between a script and model-driven delegation, setting the run budget, merging lanes, reviewing what a lane produced, diagnosing a run that cost more than it returned. Predicates: fans_work_across_lanes, cuts_a_build_partition, integrates_parallel_lanes, writes_a_lane_packet.",
   "evidence_sources": [
    "EV-0006",
    "EV-0010",
    "EV-0053",
    "EV-0105",
    "EV-0107",
    "EV-0108",
    "EV-0109",
    "EV-0111",
    "EV-0112",
    "EV-0167",
    "EV-0169",
    "EV-0178",
    "EV-0219",
    "EV-0244",
    "EV-0251"
   ],
   "worked_example": [
    "packs/agentic-swarm/exemplars/EX-SWARM-001-eos-v2-1-partition.md"
   ],
   "evaluation_method": "packs/agentic-swarm/CHECKS.md, the reviewable criteria for this domain, split into rows a script can decide today and rows that need a reviewer. No acceptance drill exists: packs/agentic-swarm/research/DRILL_PROPOSAL.md states the shape one would take and says plainly that it is proposed and not frozen, so no cold agent has been graded on this pack.",
   "estate_relevance": "The EOS builds itself this way and nothing else does yet. The v2 build ran two parallel lanes and the v2.1 build fanned wider over a dependency graph; those runs are the only evidence the pack has of its own architecture. No venture has used it. ADR-0006 decision 4 sends its executable half into ORG seeds through a kernel template, so a venture meets it at Genesis rather than through the EOS.",
   "owner": "EOS integrator",
   "review_trigger": "on-change-of:agent-harness-major-release"
  },
  {
   "capability": "API-and-integration-design",
   "status": "built",
   "pack": "packs/api-integration/",
   "activation": "Paths: api directories, OpenAPI, AsyncAPI and protobuf files, schema directories, webhook and connector directories, route and handler files. Task types: publishing or changing a service boundary, adding a webhook receiver, consuming a third-party API, changing an event payload, deprecating an endpoint. Predicates: exposes_service_boundary, consumes_external_api, receives_webhooks, publishes_events.",
   "evidence_sources": [
    "EV-0122",
    "EV-0123",
    "EV-0124",
    "EV-0125",
    "EV-0126",
    "EV-0127",
    "EV-0128",
    "EV-0129",
    "EV-0130",
    "EV-0131",
    "EV-0132",
    "EV-0133",
    "EV-0134",
    "EV-0135",
    "EV-0136",
    "EV-0137",
    "EV-0138",
    "EV-0139",
    "EV-0140",
    "EV-0141",
    "EV-0142",
    "EV-0143",
    "EV-0144",
    "EV-0145"
   ],
   "worked_example": [
    "packs/api-integration/exemplars/EX-API-001-invoices-api-change.md",
    "packs/api-integration/exemplars/EX-API-002-stripe-versioning.md"
   ],
   "evaluation_method": "packs/api-integration/CHECKS.md, the reviewable criteria for this domain. The acceptance drill is frozen at benchmark/drills/api-integration.md and has never been run: benchmark/drills/RESULTS.json holds no verdict for it, and ADR-0007 defers running the drills rather than treating them as a release gate.",
   "estate_relevance": "AutoWatt serves three surfaces over one API and takes vendor webhooks; WiseWattage integrates Clerk and Stripe; PatterTech_App exposes a subscribe endpoint.",
   "owner": "EOS integrator",
   "review_trigger": "2027-12"
  },
  {
   "capability": "architecture-and-system-design",
   "status": "built",
   "pack": "packs/architecture/",
   "activation": "Paths: import and dependency contract files, migration directories, decision-record directories, C4 or arc42 artefacts, module and service directories, webhook handlers, public API schema files. Task types: adding or moving a module, declaring a boundary, choosing a datastore, splitting a deployable, integrating a vendor, proving a restructure changed nothing. Predicates: has_server_code, has_multiple_modules, has_database, has_cross_language_contract, has_vendor_holding_identity_or_money.",
   "evidence_sources": [
    "EV-0146",
    "EV-0147",
    "EV-0148",
    "EV-0149",
    "EV-0150",
    "EV-0151",
    "EV-0152",
    "EV-0153",
    "EV-0154",
    "EV-0155",
    "EV-0156",
    "EV-0157",
    "EV-0158",
    "EV-0159",
    "EV-0160",
    "EV-0161",
    "EV-0162",
    "EV-0163"
   ],
   "worked_example": [
    "packs/architecture/exemplars/EX-ARCH-001-billing-catalogue-boundary.md"
   ],
   "evaluation_method": "packs/architecture/CHECKS.md, the reviewable criteria for this domain. The acceptance drill is frozen at benchmark/drills/architecture.md and has never been run: benchmark/drills/RESULTS.json holds no verdict for it, and ADR-0007 defers running the drills rather than treating them as a release gate.",
   "estate_relevance": "AutoWatt runs one record core with three surfaces, WiseWattage a Polars pipeline behind an API, PatterStudio a monorepo with import-linter rings. All three are live architecture decisions.",
   "owner": "EOS integrator",
   "review_trigger": "2027-02"
  },
  {
   "capability": "coding-and-software-construction",
   "status": "built",
   "pack": "packs/coding/",
   "activation": "Paths: source, test, build, packaging, lint and static-analysis configuration in a venture repo. Task types: IMPLEMENT, FIX, REFACTOR and CHORE against an existing codebase, and review or merge decisions on them. Predicates: edits_source, reviews_change, decides_merge.",
   "evidence_sources": [
    "EV-0164",
    "EV-0165",
    "EV-0166",
    "EV-0167",
    "EV-0168",
    "EV-0169",
    "EV-0170",
    "EV-0171",
    "EV-0172",
    "EV-0173",
    "EV-0174",
    "EV-0175",
    "EV-0176",
    "EV-0177",
    "EV-0178",
    "EV-0179",
    "EV-0180",
    "EV-0181",
    "EV-0182",
    "EV-0183"
   ],
   "worked_example": [
    "packs/coding/exemplars/EX-COD-001-webhook-silent-failure.md"
   ],
   "evaluation_method": "packs/coding/CHECKS.md, the reviewable criteria for this domain. The acceptance drill is frozen at benchmark/drills/coding.md and has never been run: benchmark/drills/RESULTS.json holds no verdict for it, and ADR-0007 defers running the drills rather than treating them as a release gate.",
   "estate_relevance": "Every venture that ships code. This is the pack most tasks in the estate will load.",
   "owner": "EOS integrator",
   "review_trigger": "2027-02"
  },
  {
   "capability": "delivery-testing-and-quality",
   "status": "built",
   "pack": "packs/delivery-testing/",
   "activation": "Paths: test trees, conftest files, anything named for a fake, stub, mock or double, CI workflow files, coverage, mutation and retry configuration. Task types: FIX, FEAT and REFACTOR always, plus any task the router rules R2 or higher. Predicates: ships_code, has_test_suite.",
   "evidence_sources": [
    "EV-0184",
    "EV-0185",
    "EV-0186",
    "EV-0187",
    "EV-0188",
    "EV-0189",
    "EV-0190",
    "EV-0191",
    "EV-0192",
    "EV-0193",
    "EV-0194",
    "EV-0195",
    "EV-0196"
   ],
   "worked_example": [
    "packs/delivery-testing/exemplars/EX-DEL-001-drifted-fake-and-a-lying-suite.md"
   ],
   "evaluation_method": "packs/delivery-testing/CHECKS.md, the reviewable criteria for this domain. The acceptance drill is frozen at benchmark/drills/delivery-testing.md and has never been run: benchmark/drills/RESULTS.json holds no verdict for it, and ADR-0007 defers running the drills rather than treating them as a release gate.",
   "estate_relevance": "AutoWatt and WiseWattage both carry suites with drifted doubles; the test-timing ablation sets this pack's defaults from measured evidence.",
   "owner": "EOS integrator",
   "review_trigger": "2028-02"
  },
  {